Issue ID,URL,Title,State,Description,Author,Author Username,Assignee,Assignee Username,Confidential,Locked,Due Date,Created At (UTC),Updated At (UTC),Closed At (UTC),Milestone,Weight,Labels,Time Estimate,Time Spent
87,https://gitlab.com/stephlaf/gueshly/-/issues/87,Member Private chat with Friends,Open,As a Member I want to private chat with friends,Stephane Lafontaine,stephlaf,"","",No,No,,2020-01-06 20:32:38,2020-01-10 05:32:07,,Friends (Member),,Friend system,0,0
88,https://gitlab.com/stephlaf/gueshly/-/issues/88,Member Block Friend,Open,As a Member I want to block a friend,Stephane Lafontaine,stephlaf,"","",No,No,,2020-01-06 20:32:38,2020-01-10 05:32:32,,Friends (Member),,Friend system,0,0
89,https://gitlab.com/stephlaf/gueshly/-/issues/89,Member Delete Friend,Open,"As a Member I want to delete a friend

Give a reason",Stephane Lafontaine,stephlaf,"","",No,No,,2020-01-06 20:32:38,2020-01-10 05:35:03,,Friends (Member),,Friend system,0,0
91,https://gitlab.com/stephlaf/gueshly/-/issues/91,Non-member See general news / posts,Open,"As a non-Member I want to only see the general news/posts

on the homepage",Stephane Lafontaine,stephlaf,"","",No,No,,2020-01-06 20:32:38,2020-01-10 05:37:04,,Non-Member,,Non-member games,0,0
92,https://gitlab.com/stephlaf/gueshly/-/issues/92,Non-member See price list,Open,As a non-Member I want to see the price with and without the different memberships (download prices),Stephane Lafontaine,stephlaf,"","",No,No,,2020-01-06 20:32:38,2020-01-10 05:38:35,,Non-Member,,Non-member games,0,0
93,https://gitlab.com/stephlaf/gueshly/-/issues/93,Non-member Share newsfeed with external websites,Open,"As a non-Member I want to share newsfeed articles with external websites

Have a quick share button on the newsfeed ADMIN ARTICLES. (The ones that only the Admin can put and are related to news about the games and/Or the platform)",Stephane Lafontaine,stephlaf,"","",No,No,,2020-01-06 20:32:38,2020-01-10 05:40:27,,Non-Member,,Non-member games,0,0
94,https://gitlab.com/stephlaf/gueshly/-/issues/94,Create Rails Structure,Open,Issue representing a nested Milestone,Stephane Lafontaine,stephlaf,Stephane Lafontaine,stephlaf,No,No,,2020-01-06 22:27:17,2020-02-14 00:04:38,,Complete MVP Backend (Rails API),,,36000,7200
95,https://gitlab.com/stephlaf/gueshly/-/issues/95,Complete MVP Backend (Rails),Open,Issue representing nested Milestone,Stephane Lafontaine,stephlaf,Stephane Lafontaine,stephlaf,No,No,,2020-01-06 22:31:16,2020-02-26 21:03:35,,Complete MVP,,,0,0
96,https://gitlab.com/stephlaf/gueshly/-/issues/96,Complete MVP Frontend (Rails & React),Open,Issue representing nested Milestone,Stephane Lafontaine,stephlaf,"","",No,No,,2020-01-06 22:32:42,2020-01-19 04:09:30,,Complete MVP,,,0,0
97,https://gitlab.com/stephlaf/gueshly/-/issues/97,Create Rails Structure,Closed,Issue representing nested Milestone,Stephane Lafontaine,stephlaf,Stephane Lafontaine,stephlaf,No,No,,2020-01-06 22:34:10,2020-02-26 21:00:41,2020-02-26 21:00:41,Complete MVP,,Backend Setup,7200,3600
98,https://gitlab.com/stephlaf/gueshly/-/issues/98,Create Rails App,Closed,"",Stephane Lafontaine,stephlaf,Stephane Lafontaine,stephlaf,No,No,,2020-01-06 22:46:28,2020-02-26 18:50:00,2020-02-25 20:29:58,Create Rails Structure,,Backend Setup,1800,1800
99,https://gitlab.com/stephlaf/gueshly/-/issues/99,Set up Rails App as API,Open,"",Stephane Lafontaine,stephlaf,"","",No,No,,2020-01-06 22:46:54,2020-02-26 18:43:54,,Set up API structure,,API Setup,0,0
100,https://gitlab.com/stephlaf/gueshly/-/issues/100,Set up Devise,Closed,"",Stephane Lafontaine,stephlaf,Stephane Lafontaine,stephlaf,No,No,,2020-01-06 22:47:19,2020-02-27 00:59:39,2020-02-26 20:24:55,Create Rails Structure,,Backend Setup,2400,2400
101,https://gitlab.com/stephlaf/gueshly/-/issues/101,Set up Pundit,Closed,"",Stephane Lafontaine,stephlaf,Stephane Lafontaine,stephlaf,No,No,,2020-01-06 22:47:39,2020-02-26 20:59:02,2020-02-26 20:59:02,Create Rails Structure,,Backend Setup,900,900
102,https://gitlab.com/stephlaf/gueshly/-/issues/102,Set up Cloudinary,Closed,"",Stephane Lafontaine,stephlaf,Stephane Lafontaine,stephlaf,No,No,,2020-01-06 22:48:04,2020-02-26 18:51:21,2020-02-25 20:29:47,Create Rails Structure,,Backend Setup,2700,2700
103,https://gitlab.com/stephlaf/gueshly/-/issues/103,Set up Active Storage,Closed,"",Stephane Lafontaine,stephlaf,Stephane Lafontaine,stephlaf,No,No,,2020-01-06 22:48:32,2020-02-26 18:39:24,2020-02-26 18:34:17,Create Rails Structure,,Backend Setup,900,900
104,https://gitlab.com/stephlaf/gueshly/-/issues/104,Set up Postman Testing Environment,Open,"",Stephane Lafontaine,stephlaf,"","",No,No,,2020-01-06 22:49:45,2020-02-26 18:44:59,,Set up API structure,,API Setup,0,0
105,https://gitlab.com/stephlaf/gueshly/-/issues/105,Set up Heroku,Closed,"",Stephane Lafontaine,stephlaf,Stephane Lafontaine,stephlaf,No,No,,2020-01-06 22:53:15,2020-02-26 18:50:45,2020-02-25 20:30:08,Create Rails Structure,,Backend Setup,3600,3600
106,https://gitlab.com/stephlaf/gueshly/-/issues/106,Draw DB Schema - users & games,Closed,"users, games & join tables: downloads & reviews",Stephane Lafontaine,stephlaf,Stephane Lafontaine,stephlaf,No,No,,2020-01-06 22:57:57,2020-02-26 22:14:48,2020-02-26 22:13:01,Set up Data Base - Basics,,Backend Setup,1800,1800
107,https://gitlab.com/stephlaf/gueshly/-/issues/107,Create DB Tables - users & games,Closed,"",Stephane Lafontaine,stephlaf,Stephane Lafontaine,stephlaf,No,No,,2020-01-06 22:58:21,2020-02-26 22:15:21,2020-02-26 22:13:04,Set up Data Base - Basics,,Backend Setup,1800,1800
108,https://gitlab.com/stephlaf/gueshly/-/issues/108,Generate Models - Basics,Closed,"",Stephane Lafontaine,stephlaf,Stephane Lafontaine,stephlaf,No,No,,2020-01-06 22:58:55,2020-03-02 18:06:36,2020-02-28 20:53:07,Complete MVP Backend (Rails API),,Backend Setup,0,0
109,https://gitlab.com/stephlaf/gueshly/-/issues/109,Create Routes - Basics,Closed,"",Stephane Lafontaine,stephlaf,Stephane Lafontaine,stephlaf,No,No,,2020-01-06 22:59:16,2020-03-02 18:07:05,2020-02-28 20:53:05,Complete MVP Backend (Rails API),,Backend Setup,0,0
110,https://gitlab.com/stephlaf/gueshly/-/issues/110,Write API Documentation,Open,"",Stephane Lafontaine,stephlaf,"","",No,No,,2020-01-07 21:03:31,2020-02-26 18:45:37,,Complete MVP Backend (Rails API),,API Setup,0,0
111,https://gitlab.com/stephlaf/gueshly/-/issues/111,Member turn blog into Forum,Open,"As a Member I want to turn a blog post into a Forum conversation

where THERE people will be able to have replies and discuss",Gueshly Masson,guesh333,"","",No,No,,2020-01-11 23:02:27,2020-02-27 19:08:19,,Forums / Posts (Member),,Member forum/posts,0,0
112,https://gitlab.com/stephlaf/gueshly/-/issues/112,Set up gitlab branch structure,Closed,"Set up gitlab branch structure:

Rename current origin to 'development'

Create 'test' branch

Create 'qa' branch

Create 'production' branch",Stephane Lafontaine,stephlaf,Stephane Lafontaine,stephlaf,No,No,2020-02-28,2020-02-25 20:36:36,2020-02-26 18:33:07,2020-02-26 18:33:07,Create Rails Structure,,Backend Setup,2700,2700
113,https://gitlab.com/stephlaf/gueshly/-/issues/113,Install & Configure Thredded gem (Forum),Open,,Stephane Lafontaine,stephlaf,Stephane Lafontaine,stephlaf,No,No,,2020-02-27 19:05:49,2020-02-27 19:06:00,,Forums / Posts (Admin),,Admin Forum/posts,0,0
114,https://gitlab.com/stephlaf/gueshly/-/issues/114,Set up Sweet Alert,Open,"",Stephane Lafontaine,stephlaf,Stephane Lafontaine,stephlaf,No,No,,2020-03-02 18:04:28,2020-03-04 20:27:06,,,,Front End,0,0
115,https://gitlab.com/stephlaf/gueshly/-/issues/115,Investigate File system for games,Open,,Stephane Lafontaine,stephlaf,Stephane Lafontaine,stephlaf,No,No,,2020-03-02 20:27:42,2020-03-18 18:48:10,,Games (Selling),,Games (Selling),0,0
116,https://gitlab.com/stephlaf/gueshly/-/issues/116,User can create an account,Closed,"",Stephane Lafontaine,stephlaf,Stephane Lafontaine,stephlaf,No,No,,2020-03-04 20:38:08,2020-03-08 20:56:32,2020-03-08 20:56:32,User accounts - Devise,,User - Devise,0,0
117,https://gitlab.com/stephlaf/gueshly/-/issues/117,User can change password,Closed,"",Stephane Lafontaine,stephlaf,Stephane Lafontaine,stephlaf,No,No,,2020-03-04 20:38:42,2020-03-18 18:41:36,2020-03-18 18:41:36,User accounts - Devise,,User - Devise,0,0
118,https://gitlab.com/stephlaf/gueshly/-/issues/118,User can upload avatar,Closed,"",Stephane Lafontaine,stephlaf,Stephane Lafontaine,stephlaf,No,No,,2020-03-04 20:39:06,2020-03-08 20:56:30,2020-03-08 20:56:30,User accounts - Devise,,User - Devise,0,0
119,https://gitlab.com/stephlaf/gueshly/-/issues/119,User can retrieve lost password,Open,"",Stephane Lafontaine,stephlaf,Stephane Lafontaine,stephlaf,No,No,,2020-03-04 20:39:49,2020-03-17 22:06:04,,User accounts - Devise,,"On Hold,User - Devise",0,0
120,https://gitlab.com/stephlaf/gueshly/-/issues/120,User can delete their account,Closed,"",Stephane Lafontaine,stephlaf,Stephane Lafontaine,stephlaf,No,No,,2020-03-04 20:40:22,2020-03-18 18:34:54,2020-03-18 18:34:54,User accounts - Devise,,User - Devise,0,0
121,https://gitlab.com/stephlaf/gueshly/-/issues/121,Fix unresponsive dropdown link in navbar,Closed,,Stephane Lafontaine,stephlaf,Stephane Lafontaine,stephlaf,No,No,,2020-03-04 20:44:06,2020-03-18 18:33:46,2020-03-18 18:33:45,,,User - Devise,0,0
122,https://gitlab.com/stephlaf/gueshly/-/issues/122,Create User Profile Page,Closed,,Stephane Lafontaine,stephlaf,Stephane Lafontaine,stephlaf,No,No,,2020-03-04 20:47:31,2020-03-08 20:56:27,2020-03-08 20:56:27,User accounts - Devise,,User - Devise,0,0
123,https://gitlab.com/stephlaf/gueshly/-/issues/123,Default avatar upon creation of user account,Closed,,Stephane Lafontaine,stephlaf,Stephane Lafontaine,stephlaf,No,No,,2020-03-06 21:41:50,2020-03-08 20:56:22,2020-03-08 20:56:22,User accounts - Devise,,User - Devise,0,0
124,https://gitlab.com/stephlaf/gueshly/-/issues/124,Create Index page for Users - Admin,Closed,,Stephane Lafontaine,stephlaf,Stephane Lafontaine,stephlaf,No,No,,2020-03-06 21:43:08,2020-03-18 18:35:02,2020-03-18 18:35:02,User accounts - Devise,,User - Devise,0,0
125,https://gitlab.com/stephlaf/gueshly/-/issues/125,Bug fix & new features easy to implement,Closed,,Stephane Lafontaine,stephlaf,Stephane Lafontaine,stephlaf,No,No,2020-03-12,2020-03-12 18:40:54,2020-03-18 18:34:44,2020-03-18 18:34:44,,,,0,0
126,https://gitlab.com/stephlaf/gueshly/-/issues/126,Add multi prices to games,Closed,,Stephane Lafontaine,stephlaf,Stephane Lafontaine,stephlaf,No,No,,2020-03-17 22:05:24,2020-03-18 18:41:39,2020-03-18 18:41:39,Games (Admin),,Admin Games,0,0
128,https://gitlab.com/stephlaf/gueshly/-/issues/128,Setup the game prices automatically,Closed,"Have the game prices calculated automatically according to the membership levels.

There are four memberships level: bronze (0-3 months), silver (3-6 months), gold (6-1year), platinum (1y+)
So for every game, there are 5 prices available:

non-member (full price)
bronze (10% cheaper)
silver (20% cheaper)
gold (30% cheaper)
platinum (50% cheaper)
 
If I could just put the first non-member price and then it would automatically calculate all the others, it would be great.

Non-member price should appear in games index cards (when not logged in)
Non-member price & all prices should appear in games show cards (when not logged in)
",Gueshly Masson,guesh333,Stephane Lafontaine,stephlaf,No,No,,2020-03-18 19:12:27,2020-04-02 21:08:25,2020-03-21 02:10:22,Games (Admin),,"Admin Games,Memberships",0,0
129,https://gitlab.com/stephlaf/gueshly/-/issues/129,Display $0 game prices as 'Free',Closed,Make games prices as Free (instead of 0$),Gueshly Masson,guesh333,Stephane Lafontaine,stephlaf,No,No,,2020-03-18 19:14:55,2020-03-21 02:10:20,2020-03-21 02:10:19,Games (Admin),,"Admin Games,Memberships",0,0
130,https://gitlab.com/stephlaf/gueshly/-/issues/130,Add extensions,Open,"Possibility in the 'Edit Game' to add extensions or map packs (just a file that people can download). 

NOT MVP",Gueshly Masson,guesh333,"","",No,No,,2020-03-18 19:17:58,2020-03-18 19:17:58,,,,Admin Maintenance,0,0
131,https://gitlab.com/stephlaf/gueshly/-/issues/131,Bugfix 0318,Closed,Fix error on show page when user not logged in,Stephane Lafontaine,stephlaf,Stephane Lafontaine,stephlaf,No,No,,2020-03-18 19:27:42,2020-03-21 02:10:24,2020-03-21 02:10:24,Games (Admin),,"Admin Games,Bugfix",0,0
132,https://gitlab.com/stephlaf/gueshly/-/issues/132,Ask For Payment when trying to Sign In,Open,"When someone is trying to sign up on the platform, it needs to ask for a payment",Gueshly Masson,guesh333,"","",No,No,,2020-03-18 20:45:20,2020-03-18 20:45:20,,,,Memberships,0,0
133,https://gitlab.com/stephlaf/gueshly/-/issues/133,Memberships upgrade automatically,Open,"Every level has its according amount of time. After each amount of time, membership upgrades to the next following membership level. 
from bronze --> silver --> gold --> platinum .",Gueshly Masson,guesh333,"","",No,No,,2020-03-18 20:50:07,2020-03-18 20:50:07,,,,Memberships,0,0
134,https://gitlab.com/stephlaf/gueshly/-/issues/134,Make a game not visible when game is set to StandBy,Open,"When admin changes a game availability to Standby, the game needs to not be visible to members (As we talked on the phone)",Gueshly Masson,guesh333,"","",No,No,,2020-03-19 03:11:59,2020-03-19 03:11:59,,,,Admin Maintenance,0,0
135,https://gitlab.com/stephlaf/gueshly/-/issues/135,Install & Configure Administrate Gem,Open,"",Stephane Lafontaine,stephlaf,Stephane Lafontaine,stephlaf,No,No,,2020-05-15 15:03:00,2020-05-15 15:03:00,,Admin panel - Administrate gem,,Admin Panel,0,0
